Rating,Comment,Review_text
5,Mind-blowing purchase,Add free phone 😊READ MORE
5,Terrific,Excellent phone normal day to day users.. simple and cleanREAD MORE
4,Pretty good,Camera quality medium but otherwise okREAD MORE
4,Delightful,It is a great phone..... I loved itREAD MORE
3,Just okay,Don't expect too much.This is good in this price..READ MORE
3,Does the job,Panel colour is not the same as mentioned.Much heavier.Headset is not available in the boxOnly have mobile and charger .READ MORE
4,Really Nice,colour is different from what colour is shown here and everything is wonderful.It has turbocharging too which is not specified here. I Loved this mobile phone.READ MORE
5,Brilliant,GoodREAD MORE
4,Really Nice,It gets heated while charging .Too hot .Camera is okPerformance is goodBatter is perfect.Some new features with android 11.READ MORE
4,Wonderful,"It should be full HD at this price, more than 10 k any phone should have full HD,,READ MORE"
5,Wonderful,Value for money.. Avg phoneREAD MORE
5,Terrific,very nice productREAD MORE
3,Just okay,"For some apps UI not supporting, for some apps it's difficult to go backwards, charging slowly. I upgraded g3 to g30 so, feeling betterREAD MORE"
3,Fair,"Disappointed with the product. 64mp camera is not upto the mark. Image quality is not good. 13 mp primary camera is also not good. 5000mah battery takes much time to charge full. But drains too fast. Phone Lags frequently ... Dissatisfaction. Waste of money. Please try some other products like mi , realme etc in this range.READ MORE"
3,Good,Best phone under 10000READ MORE
5,Must buy!,Good Only....READ MORE
4,Wonderful,Good product for  simple usersREAD MORE
3,Good,"Front camera is worstGets heated while using mobile internet, works fine with wifiHeavy and bigger sizeDisplay is goodREAD MORE"
4,Value-for-money,GoodREAD MORE
3,Decent product,Camera is very poorREAD MORE
4,Very Good,NycREAD MORE
4,Really Nice,Charging is fast but phone gets heat while charging.READ MORE
5,Best in the market!,It's awesome product..!!!And i must say that delivery is so fast...!!!READ MORE
4,Really Nice,Nice mobileREAD MORE
4,Nice product,Camera goodREAD MORE
3,Fair,Slightly heating issue during charging.Camera avarage quality (as per 64MP)READ MORE
5,Best in the market!,Good nice phoneREAD MORE
3,Does the job,Battery capacity not good slowly chargingREAD MORE
5,Best in the market!,Value for money and Working goodREAD MORE
5,Classy product,Before ontime delivered...Great Filpkart..READ MORE
5,Mind-blowing purchase,Moto provide best economic phone.Flipkart shows again there bad service.....1) told arrive in 1hr and come after 6 hrs2) for minor thing they deduct ammount in exchange mobileREAD MORE
5,Excellent,Very good phone....READ MORE
3,Does the job,Performance wise very disappointed. For cost okPico m3 far better with 6gb ram and 128gb storage.READ MORE
2,Could be way better,This phone is not as expected. Camera is very poor quality and the battery is avarage.  Battery life is draining too fast. It is not a good phone. This phone make me very disapointed.READ MORE
3,Nice,Phone is not bad.READ MORE
5,Excellent,GoodREAD MORE
1,Absolute rubbish!,"received Moto g30 before 4 days , mobile heating issue with new mobileREAD MORE"
1,Worst Motorola G series Product Everrrr!!!,"Until now I used Moto G (Firsts Generation) for almost 7 years now and it still works like a charm.. but to upgrade I bought this new Moto G30 thinking it is going to be far better than its predecessors, but it's the worst phone ever by motorola. It has a 64MP AI quad camera which captures the worst quality pictures and it is literally slower in performance and hangs quite a lot. It overheats quickly and even though it has a 5000MAh battery it doesn't last that long. I'm very very disappointe...READ MORE"
1,Don't waste your money,Worst battery!! Don't buy.. Battery doesn't not stay even a day long for screen hours less than 2 hrs a day.. don't buy this. Writing feedback after 2 days of usage..READ MORE
1,Useless product,Not satisfied with the camera.64 mp camera is not better than my 13 mp camera phoneREAD MORE
1,Waste of money!,"Camera  was worst quality, but mentioned  64mp, charging  time take more  hrs, bad experienceREAD MORE"
2,Bad quality,"Very poor performance and poor camera, battery when compared to other moto phones. Colour is not as shown in images.READ MORE"
1,Absolute rubbish!,"Terrible phone !! Screen display  is average, camera is below average. Not worth the hype and doesn't do justice to hard earned money. I tried to return it on Flipkart but didn't work out,  was left with no option but to order another phone of redmi....it's a pity that money is wastedREAD MORE"
1,Worst experience ever!,"After using turbocharger for two hours, the battery does not get charged to 100%. It gets discharged very fast. I replaced my earlier phone mainly for this reason. Thoroughly disappointed.READ MORE"
5,Simply awesome,This mobile is awesomeREAD MORE
5,Fabulous!,Very good mobile this is best for me in my budgetThanks MotoREAD MORE
5,Perfect product!,EXCELLENTREAD MORE
1,Waste of money!,"Don't buy this phone ,at this price it is completely waste of money , it's processor is worst, coming to camera it's 64 mp takes piks like 2 mp zoom is waste  only again coming to the battery not even giving backup for one day also with no use finally I would like to say you that ,this mobile is worst,😰😰😰😰😰even while uploading these images I got problem s,I am not happy with this phoneREAD MORE"
4,Value-for-money,Review after first day usage..Camera is not at all good..Poor performance of camera..Screen size is large..Phone is little bit bulky...Fast charging takes mosre than 1 hr to become 100% from 50%Based on this Budget not bad.. Don't expect more..READ MORE
2,Expected a better product,Camera is not goodREAD MORE
3,Decent product,"I'm sure the camera is not 64MP,it's a trick to attract peopleREAD MORE"
5,Perfect product!,Good phone value for this money.READ MORE
5,Terrific,Good luckingREAD MORE
5,Worth every penny,camera cwolitiy bestREAD MORE
1,Unsatisfactory,"Dont buy very thirdclass phone.and flipkart facility very painfull i sufferd for It has not been 10 days for the useless mobile, neither Flipkart is giving any response nor is Flipkart doing any solution DONT BUY THIS MOBILEREAD MORE"
2,Moderate,problem charging is a very slowlyREAD MORE
1,Utterly Disappointed,"The mobile is heating up very quickly and the battery drains very fast.  On top of it, there is some issue with audio jack.  Flipkart can't handle the issue.  Don't try this mobileREAD MORE"
5,Simply awesome,Might be good but motorola can optimise their software...READ MORE
4,Value-for-money,Good phone for this priceREAD MORE
5,Worth every penny,Ratings as Per My Use since 5days.Camera 4Battery 4Performance 4Body Design 5Gaming 3.5Charging time 3hrsBattery backup 2.5days with or without data.Accessories ChargerMobile coverREAD MORE
5,Just wow!,A good phone in budget priceREAD MORE
5,Fabulous!,Very nice phone and great performance.READ MORE
1,Battery draining quickly.,Pros:Excellent phone with smooth user experience. Cons:1. Camera quality  is not up to mark. Image processing is not good. 2. Battery draining in normal usage quickly.READ MORE
5,Terrific,"Best phone at this budget and much better than realme ,redmi poco,oppo,vivo and samsungREAD MORE"
5,Simply awesome,Very good productREAD MORE
4,Very Good,GoodREAD MORE
3,Does the job,"Average phone, poor camera.READ MORE"
1,Horrible,Not good this phone battery is not goodREAD MORE
1,Very poor,Display glass quality is very poor. It had broken on 1 feet height without tempered glass when I was doing charge my mobile camera quality so poor it like only 2 mp cameraREAD MORE
5,Great product,Best mobile under 10k budget. Fully satisfied with the featuresREAD MORE
5,Simply awesome,NiceREAD MORE
5,Highly recommended,AwesomeREAD MORE
4,Value-for-money,Very good 😊READ MORE
1,Absolute rubbish!,Camera quality is very poor. Not recommending this phone if you are looking for good camera quality.READ MORE
5,Perfect product!,Value for moneyREAD MORE
5,Just wow!,Good phoneREAD MORE
4,Good quality product,Simply awesome for professional and above 25 of age with peace of mind for data protection and stock androidREAD MORE
5,Just wow!,GoodREAD MORE
5,Terrific,very good at this price... stock android 11. No Ads... superb..READ MORE
1,Don't waste your money,I expected more but this is just ok productREAD MORE
1,Unsatisfactory,China phone 2 or 5 mp camera is better.They said 64 mp camera it's better 5 mp can give better pictures. Worst camera. I exchanged resmi note 7 pro. Feeling bad that unnecessarily I gave my old mobile. Camera is worst worst.READ MORE
4,Wonderful,AwesomeREAD MORE
5,Mind-blowing purchase,I just love everything about this phone Every thing on it it's super....!!READ MORE
1,Worst experience ever!,Heating problem within 5min useREAD MORE
1,Horrible,"1. Camera quality very bad, 2. Battery drain very fast. 3. UI lagging.3. Network and wifi good.Most important after purchasing flipkart will not help for return.READ MORE"
1,Hated it!,Camera quality is very poor.it shows 64megapixel but image quality like as 5 megapixel. Mobile Hang and automatically restartREAD MORE
4,Good choice,Nice phoneREAD MORE
4,Value-for-money,Overall product is good but I don't understand why my battery drain so fast 😐READ MORE
1,Horrible,The worst ever Motorola phone ever ... Worst camera and I have been using moto phones from feature models ...Takes lot of time of charging though they mentioned turbo charging . Stated 64mp camera but it's some where 5 mp frankly .. utterly disappointed .I have bought this in their first release but got a lesson not to purchase in the first sale....Pls don't buy this . It's fine of you get some other chinese phones in this budgetREAD MORE
1,Waste of money!,Worst phone and  flipcart also worst👎 never buy anything from flipcartREAD MORE
5,Wonderful,"IN LOVE WITH THE PHONE!!! MUST BUY!!! ITS EVEN GOT A COVER, I LOVE IT!!!READ MORE"
2,Moderate,Disappointed by Motorola first time this product has poor camera quality (as it's promising 64MP) and it's heating on normal usage to..READ MORE
5,Highly recommended,AmazingREAD MORE
1,Worst experience ever!,Automatically e insert sim all apps fast not openSpeaker volume very low disturb calling talk I am not satisfied this mobileREAD MORE
1,Don't waste your money,Bettery backup v bad sound also bad all over not goodREAD MORE
5,Perfect product!,Very good product ❤️very good cameraREAD MORE
2,Bad quality,Camera quality is not goodREAD MORE
5,Terrific,The best from moto. I loved itREAD MORE
4,Very Good,GoodREAD MORE
1,Unsatisfactory,Worst phone everREAD MORE
5,Terrific,Everything is perfect except battery. I really love all the features. I recommend these phone to all. Battery Capacity is not good from my exceptation.READ MORE
5,Worth every penny,Excellent 😘READ MORE
5,Awesome,Very good phone in this rangeREAD MORE
4,Pretty good,Its a Good Phone. Nice design and Weightless mobile.the only disadvantage is the display is not as much as good. otherwise overall its fantastic!READ MORE
4,Pretty good,Best quality productsREAD MORE
4,Wonderful,Camera's need to improveREAD MORE
2,Bad quality,It's too heavy and big size like Power Bank think 2 times before buyREAD MORE
5,Fabulous!,"No Oleophobic coating on the screen or atleast a screen protector is a bummer for me for this price.Camera performance in not upto the mark. They say 64mpx but the pic quality is like that of a 13 mpx camera, which needs an update sooner.READ MORE"
2,Moderate,1.Heating problem 2. Slow processing3.Taking time to open Camera4.Take too much time to chargeREAD MORE
5,Terrific,ExcellentREAD MORE
4,Pretty good,nice phoneREAD MORE
5,Excellent,Very nice MotoREAD MORE
5,Brilliant,"I trust Motorola .... because they given the first mobile in the world.....in my concept Motorola is the mother of all mobiles...... this moto g30 also excellent...... camera quality , battery life , display... everything is good.......READ MORE"
5,Simply awesome,Great productREAD MORE
5,Super!,SuperREAD MORE
2,Slightly disappointed,Something wrong hitting issueREAD MORE
4,Very Good,Good looking with great performanceREAD MORE
4,Delightful,Camera not good.  As we compare  vivo 32 mp is more good. Battery comes oneday. If going to use normal.  Okay to buy.READ MORE
3,Does the job,GudREAD MORE
3,Good,"Camera struggles a lot to focus on text of a document. Really bad and unexpected. 1 good thing I noted, it blurs background of a object in clicks, throws some extra focus & depth that enhances the object view. Check in pic. Battery could have been better, screen felt average or ok. Display is again just okREAD MORE"
5,Mind-blowing purchase,Must buy no other phone is better than Moto I have started using Moto phones since G4 plus have launched.  Trust it blindly and in this range what else you expect..READ MORE
4,Pretty good,"Its a good phone, after 1 month i can say thisREAD MORE"
5,Awesome,Good phoneREAD MORE
1,Don't waste your money,Only camera and battery is good and all performance is not goodREAD MORE
5,Excellent,GoodREAD MORE
1,Very poor,Display is not 90Hz. Switch on the developer mode and there you'll find out. That's a sure lie.Camera is of low quality. Can't capture with detailing. Weight of the device is too much.READ MORE
4,Pretty good,good phone under 12KREAD MORE
4,Pretty good,good phone under 12KREAD MORE
1,Absolute rubbish!,Display worstREAD MORE
5,Classy product,Thankyou flipkart 😊READ MORE
5,Simply awesome,Wow superREAD MORE
5,Classy product,Amazing i am happy with motorola g 30READ MORE
5,Mind-blowing purchase,The phone is perfect for everyonoe. Its just wooowREAD MORE
5,Fabulous!,Best phone in this price.Highly recommendedREAD MORE
5,Terrific,Very goodREAD MORE
4,Wonderful,Prity goodREAD MORE
3,Nice,"Battery doesn't last even for a day with moderate use. I don't use this done for gaming or streaming,  moderate number of calls and microsoft teams for official purposes still the battery hardly last for a day. Low light performance of camera is poor, but gives good results in proper lighting. Camera and youtube crashed multiple times. If u r on a budget go for this,   I opted this fone for the price and clean android experience. No unnecessary bloatware.Display is decent. My old one plus 3 ...READ MORE"
5,Terrific,It's camera is decent... long-lasting battery....Overall the phone is very good in this price....you can go for it...READ MORE
4,Really Nice,All ok but camera performance is not work  64MP qualityREAD MORE
4,Worth the money,Good product in priceREAD MORE
4,Good quality product,"Camera (rear) performances very bad, face unlock is average. Rest seems good to me (normal usages).READ MORE"
5,Perfect product!,Overall goodREAD MORE
3,Good,Flipkart is no more trustworthy.Please do not exchange your device with flipkart. With minor scratches they will reject the exchange or else ask additional amount.Phone performance is satisfactory.Android experience is Good.Camera quality is not upto the mark.Sound quality with speaker and headphone is Good.Battery life is also good. (Approx 1.5 day)READ MORE
5,Wonderful,GoodREAD MORE
2,Not good,Avg phoneREAD MORE
5,Just wow!,GoodREAD MORE
5,Highly recommended,Best phoneREAD MORE
5,Terrific,Nice productREAD MORE
1,Waste of money!,Camera is very poor. Waste of moneyREAD MORE
5,Classy product,GoodREAD MORE
3,Just okay,Camara not supported or flip card not resolved?READ MORE
1,Not recommended at all,Camera and display are not goodREAD MORE
3,Just okay,Dont buy this phone battery  was nt so good.he can't spend full 1 dayREAD MORE
2,Expected a better product,Worst display. Camera is ok. Descent picture quality in daylight but not good in low light.Below averageREAD MORE
5,Great product,GoodREAD MORE
3,Decent product,not so good in camera and displayREAD MORE
5,Must buy!,Best Mobile under 10000READ MORE
1,Hated it!,"Waste of money to take Motorola G30. front camera is not good , touch screen is not good. Instead of Moto g30 take Moto g 5 plus.READ MORE"
3,Just okay,"Overall this phone is good for basic usage , but battery got heat up once start playing game or internet surfing for more than one 1 hour. If u are buying for basic stuff like texting or calling..then go for it.READ MORE"
1,Very poor,worst cameraREAD MORE
5,Terrific,Good customer service thank you FlipkartREAD MORE
5,Best Stock Android at 11000 (April 2021),The product is good although the packaging seemed a bit distortedREAD MORE
3,Nice,Not perfect product in motoREAD MORE
1,Terrible product,Don't purchase this phone battery is worst it's like 2000 mah battery camera is horrible..waste of money...READ MORE
5,Great product,I am happy to buy this wonderful product.READ MORE
5,Must buy!,Awesome mobile for this priceREAD MORE
4,Good choice,"It's a true value for money smartphone at this price range. Display is good with 90hz refresh rate. Camera is decent. Battery is awesome,will last 2 days easily with moderate usage and the 20w turbo charger included in the box is superb. Performance is great. The design and built quality is also fine. A must buy smartphone under 11k budget. Better than any Vivo and Oppo smartphones at this price range.READ MORE"
3,Good,"Recommended only for those who are love stock android experience.G30's camera and screen resolution 👎👎👎      My 1st aim to buy these phone for stock android experience.If you want best camera and best screen resolution G30 is not for you.My old great phone is lenovo k6 power use about 4 year and that's brilliant camera,full hd,lot of features and Extra ordinary battry life but sadly He is no more😣😣 i miss that phone. My old phone perform best camera output than G30.READ MORE"
1,Useless product,WorstREAD MORE
4,Pretty good,GreatREAD MORE
1,Horrible,Don't buy very bad I'm wasted my money I'm not happyREAD MORE
3,Nice,Battery draining very fast.Camera too slowREAD MORE
5,Terrific purchase,"I love moto phones by its gestures and it's more than average tough body than other smartphones.This time I purchased moto again because of its good quality plus fast charging and no bloatware (Bloatware is commercial software that is preinstalled on a device by the manufacturer, whether it's useful or not, and tends to waste memory and resources. While some of these apps may be useful, the majority of them simply sit there taking up storage space and in some cases, affecting the performance...READ MORE"
5,Perfect product!,Good experience with Moto mobiles. Super mobiles at lowest priceREAD MORE
1,Horrible,Don’t expect much from the camera  and performance ..as Flipkart didn’t arrange my return had no option but sold the device ... even though 665 processor but it was slow in shifting through apps.READ MORE
4,Pretty good,I like this phone ...camera quality is good...Battery capacity is normal...I'm use 30 dayes....Moto g 30...READ MORE
3,Fair,Writing this review after using moto g30 for 10 days. The battery is good. It last almost two days after normal uses. Camera is not good specially the front camera. The phone is little heavy. Just good enough for normal uses not recommended for photography.READ MORE
2,Slightly disappointed,"Don't but this phone camera is very bad , Display also Dull , lagging issue also we have purchase this phone for my dad purpose but on 1st day we will find this much issue compare to redmi note 10 the camera is very bad 64mp but look like China phone camera blur also,Don't waste your money for this budget better go to redmi 9 powder / note 10READ MORE"
4,Wonderful,Camera quality is not good and but other wise all features is good.READ MORE
2,Not good,If others call me will said switch offREAD MORE
3,Just okay,Camera is not that great. 6gb ram version would have been preferred.READ MORE
5,Brilliant,GoodREAD MORE
4,Pretty good,Wow wowREAD MORE
5,Awesome,"awesome, bloatware ad free experienceREAD MORE"
1,Waste of money!,Display is really bad. Brightness level is very low. Unable to see anything in sunlight even after putting maximum brightness. Seller is providing replacement only. Worst customer support from Flipkart. In future I will rethink before buying a product from FLIPKART.READ MORE
1,Utterly Disappointed,Slow charging....Poor cemara quality....READ MORE
5,Highly recommended,"In time delivery, and friendly behavior of the delivery boy. Highly impressed.READ MORE"
5,Fabulous!,Value for money.Lag free performance.stock android experience is good.READ MORE
1,Don't waste your money,"Don't buy any kind of product from Flipkart, the product they have given is faulty and 7 days replacement policy also not in used.Very worst experience with customer care.Regards,PravinREAD MORE"
5,Awesome,v goodREAD MORE
4,Very Good,Very nice 👌 phoneREAD MORE
5,Wonderful,Amazing phone 📱 Everything is good ☺️I love it💫READ MORE
2,Bad quality,"If you open 2 to 3 application,it starts hanging.Other things are ok but even with good RAM there is aHang issueREAD MORE"
4,Value-for-money,"In this price segment ,it is a good phoneREAD MORE"
4,Really Nice,"The phone looks good, but flipkart exchange policy is very bad. Despite software in working condition, due to discoloring of pixels the phone got rejected.READ MORE"
1,Very poor,So poor. I want to exchange this set.😠READ MORE
1,Utterly Disappointed,"Phone has multiple software bugs ; abnormal battery statistics n draining, GPS n NFC keep getting ON & OFF automatically,very poor RAM management,no option for receiving incoming calls ( sometimes ),very poor network connectivity ( I've only Jio & Airtel ),Finally no proper response from Motorola Team, as if they were in a Jiffy to launch this model.Don't know anything about camera, since I seldom use smartphone camera.READ MORE"
4,Good quality product,Value for money and this price segment is best option..and better than realme .redmi. mi. Vivi..and oppoREAD MORE
3,Decent product,"Camera average...Motorola should improve,not just launch products for competition...Motorola is bigger brand ,hence should focus to give quality not quantity.READ MORE"
1,Absolute rubbish!,Dont buy this phon camera quality is very very poor  Best of moneyREAD MORE
5,Awesome,"Excellent Camera, Nice RAM Management, Elegant Design, Awesome Product !!!READ MORE"
3,Nice,GoodREAD MORE
4,Good quality product,Good budgets phone with 2 weaknesses 1 display 2 processorREAD MORE
3,Does the job,Display is not so good. Rather opt for a fhd display of poco at this price. Performance is no doubt good. But the device has a heating issue when charging. The device and the charger both gets heated up. Value for price of course. But it could have been better.READ MORE
4,Good choice,Nice a photoREAD MORE
4,Very Good,Camera can be fixed by some settings you get a decent picBattery  performance is good and its last for one and half a day.Performance is excellent for day to day use..Built is quite heavy due to big battery but get use to it after some day.Stock android phone...And with one weak of use its worthy and u can bet on it...Not for those who are selfie addicted 🛑READ MORE
3,Does the job,overall good..READ MORE
1,Worthless,"This is about the  product, its description and content.  For this product code, there should be two sim slots and one memory slot.  But in the product supplied to me, I found that there is only one sim slot and one memory slot.  This is very bad on the part of flipkart and the supplier and shakes the confidence of the buyer in the e-commerce system.  This  is not the first time - earlier also I faced this with some other product and this type cheating (should I say) continues.  And then, som...READ MORE"
1,Horrible,Waste of money... Camera is very poor... Flipkart service also very bad... I am not satisfied their services... There is no refund...READ MORE
2,Could be way better,Camera quality is very bad as they are telling 64 mp but i think 16 mp is better than this. Battery draining very fast.READ MORE
4,Good choice,Good product....READ MORE
5,Mind-blowing purchase,Good performanceREAD MORE
4,Good quality product,GoodREAD MORE
5,Highly recommended,"Overall at this price, everything thing is balanced.It is better if it comes with Full HDBulky, thick useless bezel at bottom.Slow charging, should come at at least 30W or more power charger. Given 5 star because at this price we can't compare with 20k segment.Expect timely security updates and Android  update fron android.One line for Flipkart: product reached 4 days before to  nearest hub, but they deliver on last day doesn't make senseREAD MORE"
5,Just wow!,Beautiful lookingREAD MORE
5,Super!,Nice colourREAD MORE
5,Classy product,NiceREAD MORE
3,Good,"Negative:Face lock don't work properly,Unable to answer call most of the time.Not happy 😐😐Positive:Beautiful displayBattery is really niceRest all functions are very good ☺️☺️☺️READ MORE"
4,Value-for-money,BestREAD MORE
5,Wonderful,WowREAD MORE
4,Nice product,"Phone is good i love the product but phone heating , and display normal clarity  60 %But gud performance.READ MORE"
5,Highly recommended,ThanksREAD MORE
1,Very poor,Please don't buy it.Moto g30 is not supporting 4k video Streaming.READ MORE
5,Fabulous!,"It's battery backup is very good,,and display,,,fast processor,,READ MORE"
5,Worth every penny,"Simple, clean, bloat free android experience.READ MORE"
3,Fair,Mobile becomes a heat reservoir during charging. Battery drains within 12 hour.READ MORE
4,Good choice,Phone looking awesome but camera is not good and ram is 4only and othe products is very bad problemREAD MORE
