Rating,Comment,Review_text
3,Decent product,Loved the ColorGood FinishIt's bulky as far as size n it's physical feel is concerned.Display is very dullAlmost Stock Android makes accesability quite an easy thingCam is great for this price pointSpot Color Pic is a nice add on in camera128 GB with 6 GB ram would have been an icing on cake Battery drains off ridiculously. Software issue looks like.. else poor optimization..90htz refresh is not a gimmick.. it works and helps create a good smooth experience.READ MORE
5,Wonderful,"Overall very nice phone with all the latest feature such as android 11. Three finger screen shot , recorder and etc .battery back up is very good big display compared to other phones .camera is also good. Would recommend to buy this phone because its a budget phone with all feature.READ MORE"
5,Perfect product!,Mobile is very good and performance I gifted my sister on her birthdayShe is very happy thank u moto and also thank u FlipkartREAD MORE
5,Just wow!,"There are options out there that can give you better value for money like Poco, but this is honestly a very good phone as well. If you have price constraints or don't want to shift to other phone brands, this is the Moto phone to get while the prices are still lower. Personally, from a week's usage, I can tell you that it is a great phone from moto. The selling point for gamers would be its 90HZ refresh rate which the G10 doesn't have, & its custom gametime mode that has some functionality. N...READ MORE"
4,Wonderful,"Phone is really good in terms of value. With Micromax In1 in market, this one is not ""real"" value for money, I think. Because the display is just 720p... Motorola could have opted 1080p over 90 hertz display.The processor is really good at snappy and does no lag.The camera indoor is pathetic. If we use the pro mode of the camera, we can get a better results even in indoors. Having said that, Camera works good in daylight.I purchased this phone for my father, and my main requirement for me ...READ MORE"
4,Very Good,Overall a decent mobile to purchase if you are not a heavy user.Camera does a good job though it gives realistic pictures so don't expect them to be extra punchy and colorful.90 hz refresh rate makes the use smoother.Battery lasts long enough to not bother you.And moto unique features are like cherry on the top.You can go for it without even thinking twice.READ MORE
4,Nice product,Camer performance is ok not that wow and not that bad in this budget range good performance.Battery life is also ok if use in battery saver mode battery will.work better All over good phone in range need to work but on camera and batteryREAD MORE
5,Terrific,Every phone will have same features  but I  love Motorola because of its gestures ❤️.It hasgood batteryIt has decent cameraIt has good processing speed and smooth runningOnly thing is it has plastic body...READ MORE
5,Terrific,Best Product According to price in every aspect.I have trust on Moto because I was using Moto G5S Plus till now(used for 3+ years).Love the software experience Moto provides.Would love to see more options from Moto in 15-20k and 20-25k.READ MORE
5,Wonderful,One of my favourite brand... N love to see it's coming up with better features every time ... Specially needed this kind of features in budget oriented phones... Loved it..READ MORE
5,Highly recommended,"Best 👍 for who want a stock android phone lovers..,value for money 💰I love this one..,Everything is cool and clean I like the software.Best software experience and finest finishingThe only thing I don't like is the phone felt like little weight..,And is it really 64megapixel 😆 anywayIts a good stock android budget phone..,Suggestion-- do not buy if u don't like stock android software..,READ MORE"
5,Best smartphone for productivity.,"To be honest, didn't have much expectation with the mid-ranger but I was amazed at how well it is suited for day-to-day work.I just wanted a clean UI, quick and responsive phone. (I upgraded from SD435)The moto glass is lightyears better than a notification light.Moto's little tweaks are way too awesome.READ MORE"
4,Delightful,"Yes, the camera is not the best, the screen could have had some fine tuning, but the fact is, this is a no nonsense phone for the average Joe. I'm happy!Ratings:Design: 4 (The phone rarely looks like it does in the pictures above, more often than not, purple and even shades of green under inflorescent bulbs! But it's still classy.)Camera: 3 (It's there!)Performence: 4 (minor stutters occasionally, nothing worrying)Display: 3.5 (nothing a software update couldn't fix))Ergonomics: 3 ( the...READ MORE"
3,Fair,Pros:1. Smooth Performance And Long-Lasting Battery.2. Stock Android Software Experience.3. High-refresh rate display.4. Good price for valueCons:1. Camera Performance Seems Pretty Average.2. Full Plastic Body which really feels cheap in hand.3. No 4K video recording.4. Max display brightness is pretty weak.READ MORE
3,Good,"Camera is good👍🏻 not osm😮   , battery is poor according 5000mah☹ , display is osmm 🤩and selfie 👌🏻, stock android is osmm🤩. Bright ness is little bit . And osm think is** new advance system is osm🤩  ,, *& according to me its good average phone ,, # if you spend more money then i recommend you buy other one 🙋‍♂️READ MORE"
4,Nice product,"Camera is not as expected eventhough it's not an issue, battery life is good, complete day I used whatsapp and 4g browsing it's taken only 35 percent so battery optimization is very good. And call quality is decent level. User interface is slightly difference from others, even it's hd+ display, it's better including outdoor and nice refresh rate as I am using only auto mode. Also network speed is fine .I feel if need only call and browse as professionally, this is value for money. Did not try...READ MORE"
4,Value-for-money,Battery backup is really good. Good for light users. Worth mobile for this price.Camera is too poor. Looks like 8mp camera .Don't go for it if you are camera lover.And color looks white. Not same with one shown in picture .Otherwise overall it's good.READ MORE
4,Good choice,"Good Quality and smooth ,It's not feel like slim and wait but overall it's good product at 11kREAD MORE"
4,Pretty good,Using Moto for 6+ yrs.  Ideal for normal users at this budget with clean UI.   Same model with 6 GB RAM variant could have made this much better option to choose compare to other brands.READ MORE
5,Brilliant,"Very good Phone for gifting to elders, because of super clean software with no spoofs, a very long lasting battery and super fast and responsive display.Excellent for doing everyday tasks.Not so good for performance tasks,or for camera folksREAD MORE"
5,Classy product,"Moto G30 is overall a budgeted smart phone. Its camera is lagging for 1-2 seconds when u click pic. Also it doesn't have a auto adjustment brightness feature. I had read in other people's comments that display is not upto the mark, but i felt display is nice and smooth. Finishing is awesome and mobile didn't feel heavy also. One can go for it rather than going in MI or realme having short life span.READ MORE"
5,Super!,"Nice build, Doesn't bite your pocket, battery is okay, functional side good, touch screen looks wonderful like a feather touch. More than worth for payedREAD MORE"
5,Highly recommended,Wonderful product of Motorola G30 very best quality and best performance really i am very happy to purchase this product fully satisfied in this prices Very very thank you so much flippant. Com online shopping companies are very best and bileeve for my next shopping programsREAD MORE
2,Not good,Unbiased and genuine opinion. Bought it for my father but disappointed. Lenevo has degraded moto's standard a lot.Camera:Photos have a soft touch with blurred edges. The details doesn't match the standard of a lower budget phone like poco c3 too. Macro camera is useless. Could have used dual camera setup with better hardware atleast.Display:If you use a full hd display phone as a daily driver you can easily spot the blurred adaptive icons of the app drawer. There is no necessity of a 90h...READ MORE
4,Pretty good,"GNon nonsense, decent product for the price, good built quality, value for money & obviously the stock Android experience is always the best with the Nokia or Motorola devices...would have been even better if Motorola had launched the 6-128gb version along with thisREAD MORE"
4,Delightful,"Build quality 5Display 5Colors 3Storage capacity 5Performance 4 (Because phone becomes slightly slow while performing multiple functions) Camera 4 (Because night clicks are not at all up to the mark, daylight shots are clean but you get best quality only in 64 pixel shots, normal clicks would have been better) Battery 5 absolutely amazing. Worth the price?10 stars....!!Definitely yes... Amazing phone you can get in this price compare to other brands. If you are looking for be...READ MORE"
2,Very Disappointed with this phone,Its too big & very heavy too. Have the 1st Generation Moto phone which is still working much better than this phone. that was the perfect size which fits into the pocket very nicely. Battery life is also very bad. As everyone can see the reviews the camera is also bad. the 3 finger touch screenshot capture also doesn't work many a times. sound quality also not very good. Expected a much much better product after reading the specifications. But utterly disappointed with the product. Advice is ...READ MORE
5,Terrific purchase,"Camera is average...If you are not the one who is camera centric then I think it would be desirable to buy moto g30. Display is dull compared to other smartphones in this range. Battery- It is giant and nobody can beat moto with respect to battery performance. Gesture add on is a unique feature of moto which is praiseworthy. No heating issues, long battery pack up and fastness of this phone is what attracted me most. Overall a good buy.READ MORE"
5,Best in the market!,"It is nice but expected a better performance, because motrola is a very good brand .But this is good phone so guys go for it.READ MORE"
4,Very Good,Don't expect much. Camera is good in outdoor but struggle in low light. Battery is good enough for one full day. Performance is above average. It is a value for money product. Far better than '12' in similar price range.READ MORE
5,Mind-blowing purchase,"Best look, perfect camera with n number of options, perfect battery backup, sound is just too awesome seems like I'm playing on speakers, screen size is big, came with a back cover in the pack. Perfect option under this price range.READ MORE"
4,Good choice,"It has 64 MP quad camera that's good it depends upon how you click picture,90 HZ frequency which is nice at this price point, 5000 mAh battery that's also nice, display size is also good, screen could have been more clear when you will see it from side picture will look black, if it would have been super amoled it would have been great experience, ram is 4 GB that is good but processors could have been little bit better, it has light sensor which will adjust your phone light according, face s...READ MORE"
5,Awesome,"Nice camera setup 👍 . It's not a Chinese phone , performance good at this price point , battery life good , support fast charging ,very decently placed notification light . Wrist twist camera open gesture , metal gril placement in speaker on top.vaule for money phone strong build qualityREAD MORE"
5,Excellent,"I am proud to mention that I own Moto G30 and chose the same over nord.What I like -It's compact.Display is not the best like you get in flagship phones but yeah considering the price point it is definitely at par with the devices in this range.Processor is more than enough if you're not a pro gamer and every other task feels so smooth. Infact the entire device feels fast in daily normal usage.Google has taken care of every small detail like haptics, microphone, speakers minimalistic ...READ MORE"
4,Nice product,Hmm... Well it's good for less usage definitely not recommending to people who always stick on their phones🍁 best for mothers and grandparents kind of...READ MORE
3,Fair,"I bought moto g30 and there are mainly 3 reasons not to buy it. A) 720p screen, like no one wants that.. But good enough for  spare phone. B) There is no way to change SOS calling, on pressing the power button 3 times by mistake the phone will call the emergency helpline, mine does it once a day. Thanks moto. C) They have a secondary physical button which summons the Google assist, there is no way to remap it, it's totally useless. It's fine as a temporary phone or a backup phone, it can't be...READ MORE"
4,Nice product,Value for money. Gesture feature is fun. Hey Google works like a charm. Power button position accidentally turns of phone. Display & sound are good for what you paid. Camera is ok. Charging is fast. Go for it if want all rounder under 10kREAD MORE
4,Pretty good,It's good product by Motorola i am preferring this by using MOTO G TURBO ..NOW THIS IS ALSO very good mobile and price Worthy.thanks Motorola..For introducing..Such productREAD MORE
5,Terrific,Phone is very goodCamera - 3.5Battery -4.5Display - 3.5Performance - 4.0Look - 4.0Design - 3.5All the above considering the price range and specs given.Overall a very good decive must go.READ MORE
5,Fabulous!,Best budget phone Go for it👍🏻READ MORE
4,Nice product,Best Smartphone on this Price rangeThank you FlipcartREAD MORE
5,Fabulous!,"the very first day I thought the front cam is worst.But actually the camera provides best quality, we just need to learn how to take photos.Do proper settings The camera by default gives natural photos, we need to do changes in the settings if you want makeup and showoff selfies 😅READ MORE"
5,Great product,Superb all rounder product by motorolaREAD MORE
5,Awesome,"At this price range this is the best smartphone, that's it! There's nothing more you needwith damn looks 😍Camera                  4*Battery                   5*Performance        4*Look                       5*READ MORE"
5,Fabulous!,"Moto is always better than redmi ,vivo , oppo and etc..READ MORE"
5,Brilliant,"Superb,  mind blowing,  value for money 👌👌👌READ MORE"
5,Great product,Fantastic phone i love motorolaREAD MORE
5,Classy product,"Absolutely brilliant phone. Pure android experience at its best. Once you use this phone, you will not want to use any other phone.ProsNo adware, bloatwareVery fast and responsiveExcellent screenTop class camera and pro camera optionGood soundExcellent network signal and internet speedSturdy built.Good battery performance.Haven't found any cons yet.READ MORE"
5,Fabulous!,Most value for money mobile. I brought this after using Moto 5g for 5 months. Both the mobiles are best in market in comparison to other brands as per quality at low price. Totally value for money. Thanks Moto for giving superior quality mobile at low price.READ MORE
5,Wonderful,"This time it was really nice, and this phone is real, thanks flipkartREAD MORE"
3,Good,Brought it..just to take good pictures.. however camera is just ordinary which doesn't have quality of 64MPREAD MORE
4,Very Good,Camera clearity is good n night mode is too good but battery drain too earlyREAD MORE
5,Just wow!,Good mobile for this price rangeREAD MORE
4,Good quality product,Very beautiful Phone best budget PhoneBest 📸READ MORE
5,Excellent,"QUALITY FANTASTIC, MODEL LOOKING NICE, COLOUR COOL, PERFORMANCE VERY HIGH. CORRECT PRODUCT AND ACCESSORIES RECEIVED.THANK YOU MOTOROLA AND FLIPKART.READ MORE"
4,Very Good,64 mega pixel but clearly not showREAD MORE
5,Great product,"Nice phone in good range, good camera quality in such range phoneREAD MORE"
4,Very Good,Awesome 👍READ MORE
5,Great product,Nice phone in this range. But looking slightly bulky. Front camera is average. Back camera is awesome.READ MORE
5,Best in the market!,At this price point phone was so good If you want to purchase go for it..👌Camera 5/5Performance 5/5Battery 5/5Looks 5/5Value for money go for itREAD MORE
4,Wonderful,Awesome phone very nice camera and battery but display might be goodREAD MORE
2,Bad quality,"I'm using this mobile for last 1 month. Few drawbacks encountered:1. Worst battery performance. Previously I was using MotoG5s+ which had almost a complete day battery power even after 3 yrs of use, but this device hardly survive for 12hrs.2. Slow charging. Since Motorola is providing Turbocharger, but I don't know why it takes about 4 hrs to charge fully, and discharge within 7-10 hrs.3. Camera quality. So many functions are there for camera, but they are useless if resolution and dpi is ...READ MORE"
5,Mind-blowing purchase,I loved it value for money I like it awesomeREAD MORE
4,Wonderful,"This phone is for who loves Stock OS... Battery draining too fast...Battery: Approx 24hrs for normal usage (Call, whatsapp) &If u r looking battery monster den dis is nt fr u. I'm disappointed about batteryCamera: For this price it's good (if u r looking 4 camera centric phone den this is nt 4 u)Display: Not badConsidering to other rivals (r..lme, r..mi, o.p., V..o) this is good phone especially for those who love Stock OS...READ MORE"
4,Really Nice,"Good phone in this range with stock Android .My first Android , switched from ios to Android this time,,😀READ MORE"
5,Must buy!,"Perfect product by Motorola.Battery is ExcellentCamera quality is also very fine, as it depends on the photographer how he/she capture.Fast ChargingOne can go for it.READ MORE"
4,Worth the money,Not bad but clearty not 64MPREAD MORE
4,Good quality product,Yeah its a good product..READ MORE
1,Very poor,After using mobile I am writing a review that the performance on the mobile is low. While normal using of mobile automatically restarting which never expected from motorola. I the fan of motorola but it disappointed me. Motorola team and flipkart team to act on these. Please do the necessary action and rectify the issue or replace the mobile.READ MORE
5,Brilliant,"Don't go on the negative reviews , those people are habitual to the chinese phones which are unreliable. I bought this beautiful set and its worth buying i am sure atleast it won't blast in my hands. 😜READ MORE"
5,Excellent,Good phone with great performanceREAD MORE
5,Wonderful,Great phone 🔥🥰.READ MORE
5,Mind-blowing purchase,"Wonderful Product.  Budget phone, Camera & battery  Superb, and Display also nice.READ MORE"
5,Great product,Front camara is okBack camera is goodNight vision not all good.READ MORE
1,Worthless,I am very  disappointed from Motorola.. specifically  camera.. camera looks like 8 mp but they said 64.. really???READ MORE
5,Mind-blowing purchase,SuperREAD MORE
5,Perfect product!,Nice MobileREAD MORE
4,Good quality product,Look niceREAD MORE
5,Must buy!,Excellent mobile for a good price.PROSGood battery lifePure Android experience without bloatware and adwareGood camera with pro camera90hz displayFast processing CONSnot muchLittle bit bulky.READ MORE
5,Simply awesome,5 rating above... excellent mobile battery after full charge lasts 2 days... excellent camera very fast....no cons... best mobile at this price...READ MORE
4,Good choice,Based on my experiences with Moto G3 and X Play devices this could be a bit more simpler in matters of usability. It would be appreciated even though this bulky and heavier design is an R&D deviation with higher focus on Camera and Graphics. Turbo charging too takes above 2hours to get it full.READ MORE
5,Classy product,Those who are looking decent smartphone ..classy then  go.for moto G30 .value for money and performance is good..it won't disappoint you.READ MORE
5,Mind-blowing purchase,"Best phone in this range, battery backup is awesome. Camera quality is also Good. The images are clear even in night mode and ultra Resolution camera gives us grt images.Battery if i use whole day with internet last for 1and half daysREAD MORE"
1,Very poor,This is most worst phone I have purchased in my life before I purchased three phones from Flipkart but this time experience is not good. My review on this phone Camera Rear camera is 64 mp but it not more then 13 mp very poor pixel Night sensor zero % workBattery performance is good its charging is not according 20v no fast charging Sound quality is ok Display is also okSim and card having hybrid slot My suggestion for young generation don't buy this phone at all.READ MORE
4,Good quality product,Very grateful my moto g30 phoneREAD MORE
5,Awesome,Camera just awesome inbuilt editor is just like pro .. it's a fully super phone..READ MORE
4,Nice product,if anyone have low budget then go with Motorola G30 best phone in low price and camera quality is average not too goodREAD MORE
5,Awesome,GreatREAD MORE
4,Worth the money,Very nice 👍READ MORE
5,Worth every penny,Very good produced Good camera 64mpREAD MORE
5,Brilliant,Super fast delivery and excellent job by delivery boyREAD MORE
5,Great product,Sooo happy..Thanku sooooo much flipcartREAD MORE
4,Good quality product,Very nice phoneREAD MORE
5,Mind-blowing purchase,Very best qualityREAD MORE
4,Really Nice,Awesome phone.. Thanks FlipkartREAD MORE
4,Nice product,"Overall great phone. But, even the Dark Pearl color is a lot light shade. It looks more like silver under bright light.READ MORE"
5,Terrific,Fantastic phone with amazing features at reasonable priceREAD MORE
4,Good choice,Good for the price. Stock android experienceCamera 2/5READ MORE
1,Utterly Disappointed,Was expecting a better product considering Motorola as a brand .. Camera is worse ... Video playing experience is bad too.20 watt charging takes 2.5 to 3 hrs to fullREAD MORE
4,Good choice,GoodREAD MORE
1,Horrible,Not looks as similar as picture. Very poor camera performance. Getting hang also. Night vision 64MP camera is fake n not working. Waste of moneyREAD MORE
5,Excellent,Good Delivery Service.READ MORE
1,Hated it!,Have hanging problemREAD MORE
5,Highly recommended,Good mobile.READ MORE
4,Wonderful,Nice phoneREAD MORE
4,Worth the money,"Performance is good. Battery lasts for 30hrs for an average usage on 4g.Camera quality is average , you need to edit settings for better picture.In colour shots is working.Almost using 100+ apps on it . Touch & screen quality is best.Hybrid sim slots but am using two sims instead of MMC card.Finger print sensor is a quick.Face unlock is a bit slow.Have played games without a lag ...I have ordered dark pearl 64 gb .READ MORE"
5,Terrific,Nice one...Google assistant key is available..READ MORE
5,Brilliant,Value for money...One of the excellent product. I received within 24 hours after ordering. Thank u flipkartREAD MORE
1,Horrible,"Hybrid slot, not good compare to other phones. Camera also not good. Hanging problemREAD MORE"
1,Hated it!,The camera is bad. It's tooo bad that I will never buy a motorola mobile again.READ MORE
1,Very poor,"If u r looking for a budgeted smartphone than this phone is for you must buy..This is my 5th Moto phone Moto never disappoints Don't hesitate go for it, sure u gonna like itREAD MORE"
5,Classy product,"Size Waight is Good, Camera Average But Price Also Low so ok, Battery Good,Rs  9999 with sbi credit card offer,READ MORE"
4,Very Good,"Phones overall performance is good at this price segment, but their camera performance in like 24 mega pixel ..READ MORE"
5,Must buy!,Mobile is very good 😃☺️😃READ MORE
5,Fabulous!,Very nice moto jiREAD MORE
5,Must buy!,Good oneREAD MORE
5,Highly recommended,One word Excellent and Value for money.READ MORE
5,Must buy!,Good product good cameraREAD MORE
5,Classy product,I got the genuine productREAD MORE
4,Good choice,Required 128+6 gb option.Expected some upgrade processor.READ MORE
5,Simply awesome,"It's a good phone, good camera, would recommendREAD MORE"
5,Terrific,Not bad in this price range.READ MORE
5,Terrific,Budget mobile.Happy man.READ MORE
5,Terrific purchase,"Best phone in this range with 90Hz display and 64MP quad camera, fast charging and much more.READ MORE"
5,Fabulous!,Very good quality and very good Flipkart Service for Dilivery in two daysREAD MORE
2,Slightly disappointed,Face lock quality is very poorBattery performance is also average not as a 5000 mAh battery work'sREAD MORE
3,Fair,Charging time is 0 To 100% is 3.30min it's not a fast charging. Please develop this option in this productREAD MORE
4,Wonderful,It is a good budget phone which can be used for daily purposes such as calling & Social Media. Battery is good which will give you a whole day power with single charge...Preferred for students for online class purposes only...This phone does support gaming but there are heating issues and some lags while playing Huge games such as COD....READ MORE
3,Decent Phone - Avg Camera - Ok for Money,"Let me list out all the pros and cons of this Moto G30. Pros: -Stock Android -Overall Build and Quality - -Price (11k) -USB C Charging-Display 90 hz, you can watch videos more smoothly and more frames per second. Cons: -Camera is avg at best, Disappointed with moto. 64 MP is just on paper, its quality is not that good, but then again its a 11k phone. -Extra Button for Google assistant is waste and useless. -Fast Charging problem is its Fast Draining also, thats why I am using third...READ MORE"
5,Fabulous!,"Does the job.Pros:Battery. Large display. Android version.Cons:Llittle lag while using multiple apps at a time.Camera is not up to the mark but fine for this price.Display is not HD+, for this price they can at least provide HD+ display.Final verdict:Good mobile packed with everything for a reasonable price.READ MORE"
5,Mind-blowing purchase,Nice productREAD MORE
3,Just okay,Not badREAD MORE
5,Highly recommended,Value for money phoneBest phone in this rangeCamera is awesomeI love itREAD MORE
